{
  "schema_version": "1.0",
  "id": "TestBox",
  "role": "task",
  "geometry": {
    "kind": "box",
    "size_m": [
      0.12,
      0.06,
      0.04
    ]
  },
  "physics": {
    "mass_kg": 0.35,
    "friction": 0.6
  },
  "visual": {
    "color_linear": [
      0.8,
      0.2,
      0.1
    ],
    "roughness": 0.5
  },
  "collision": {
    "closed_required": true
  },
  "provenance": {
    "confidence": "model",
    "source": "examples/minimal/scene.json",
    "notes": "Smoke-test fixture, not a measured object. Mass and friction are modeled placeholders: they must not be reported as identified contact parameters."
  }
}
